{
  "reagent_name": "Acetic anhydride",
  "cas": "108-24-7",
  "profile_version": "1.0",
  "handling_profile": {
    "preparation": {
      "add_to_water": true
    },
    "safety": {
      "acid_resistant_tips": true,
      "waste_disposal": "follow_institution_policy; neutralize_only_small_compatible_waste_if_trained",
      "fume_hood_required": true,
      "avoid_ignition_sources": true
    },
    "storage": {
      "flammable_cabinet": true
    }
  },
  "rules_fired": [
    {
      "id": "corrosive_add_to_water",
      "because": "Concentrated corrosive reagents (HCl, TFA, NaOH) release significant heat on dilution. Adding water to a concentrated corrosive can boil the liquid and cause spattering; always add the corrosive slowly to water. TFA and HCl volatilise in the hood \u2014 decant and dilute in a ventilated space. Waste handling is institution-specific: neutralisation is appropriate only for small compatible corrosive waste streams when performed by trained personnel with the right PPE; otherwise collect through the hazardous-waste program.",
      "cite": "Sigma-Aldrich HCl Safety Note 258148. ACS Safety in Academic Chemistry Laboratories, 7th ed., Ch. 4. EPA 40 CFR Part 261 (hazardous waste neutralisation).",
      "confidence": "high",
      "field_consensus": false
    },
    {
      "id": "fume_hood_toxic",
      "because": "The SDS (Section 7 or 8) specifies ventilation controls or fume hood use for this reagent. This category spans volatile toxic solvents (pyridine, DMF, heptane), cytotoxic and genotoxic compounds (docetaxel, streptozocin, azoxymethane), and reagents whose vapours or aerosols pose an inhalation hazard. A chemical fume hood provides the primary engineering control \u2014 never handle these reagents on the open bench.",
      "cite": "OSHA Laboratory Standard 29 CFR 1910.1450. Manufacturer SDS Section 7/8.",
      "confidence": "high",
      "field_consensus": false
    },
    {
      "id": "flammable_storage",
      "because": "Flammable liquids (flash point < 60\u00b0C) generate ignitable vapours at or near room temperature. NFPA 30 and OSHA 29 CFR 1910.106 require storage in FM-approved flammable liquid storage cabinets whenever quantities exceed the exempt amount in standard laboratory containers. Class IB/IC solvents (heptane fp \u22124\u00b0C, ethyl acetate fp \u22124\u00b0C, pyridine fp 20\u00b0C) have vapour densities > 1 and will pool at floor level near ignition sources such as hot plates and electrical outlets. Hood use is governed by volatility, toxicity, open-container volume, and SDS ventilation language; the flammable flag alone is enough to require storage and ignition-source controls, but not enough to make every small transfer a hood-only operation.",
      "cite": "NFPA 30: Flammable and Combustible Liquids Code (2021). OSHA 29 CFR 1910.106 (flammable liquids storage).",
      "confidence": "high",
      "field_consensus": false
    }
  ],
  "conflicts": []
}
