{
  "reagent_name": "Histamine",
  "cas": "51-45-6",
  "profile_version": "1.0",
  "handling_profile": {
    "storage": {
      "desiccator": true,
      "seal_tightly": true
    },
    "preparation": {
      "weigh_fast": true,
      "cap_immediately": true,
      "date_first_opening": true,
      "minimize_air_exposure": true,
      "control_static": true,
      "weighing_surface": "foil_or_glass_weigh_boat",
      "minimize_dust": true
    },
    "safety": {
      "fume_hood_required": true,
      "avoid_open_bench_weighing_if_toxic": true
    }
  },
  "rules_fired": [
    {
      "id": "desiccator_hygroscopic_solid",
      "because": "Hygroscopic and deliquescent solids absorb atmospheric water during each weighing event. Mass gain directly dilutes the effective molarity of the solution you prepare. Deliquescent solids (e.g., NaOH pellets) can become partially-dissolved slush within minutes in humid air, further confounding accurate weighing. Desiccator storage and fast weighing are the only controls for this.",
      "cite": "Sigma-Aldrich Handling Hygroscopic Compounds Technical Note. ASHP Guidelines on Handling Hazardous Drugs (weighing-by-difference rationale).",
      "confidence": "high",
      "field_consensus": false
    },
    {
      "id": "fume_hood_toxic",
      "because": "The SDS (Section 7 or 8) specifies ventilation controls or fume hood use for this reagent. This category spans volatile toxic solvents (pyridine, DMF, heptane), cytotoxic and genotoxic compounds (docetaxel, streptozocin, azoxymethane), and reagents whose vapours or aerosols pose an inhalation hazard. A chemical fume hood provides the primary engineering control \u2014 never handle these reagents on the open bench.",
      "cite": "OSHA Laboratory Standard 29 CFR 1910.1450. Manufacturer SDS Section 7/8.",
      "confidence": "high",
      "field_consensus": false
    },
    {
      "id": "air_sensitive_seal",
      "because": "Air-sensitive reagents deteriorate on contact with atmospheric oxygen or moisture. Linoleic acid oxidises to cytotoxic lipid peroxides within hours in open air. Rifampicin degrades to the inactive 3-formyl-rifamycin SV quinone on oxidation. Histamine autooxidises at alkaline pH and is also hygroscopic. DMF absorbs moisture and slowly hydrolyses to dimethylamine (an irritant). Keep bottles tightly capped between uses; aliquot into single-use volumes for high-frequency access. For oxygen-critical applications, consider dispensing under argon.",
      "cite": "Sigma-Aldrich product information: linoleic acid L1376, rifampicin R3501, DMF D4551. SDS Section 7.",
      "confidence": "high",
      "field_consensus": false
    },
    {
      "id": "powder_static_dust_control",
      "because": "Powders are the highest-risk form for static loss, inaccurate weighing, and inhalation exposure. Fine powders such as SDS, fluorescent dyes, lyophilised proteins, and many bioactive small molecules can cling to plastic boats, jump during transfer, or aerosolise during scooping. Use a foil or glass weighing surface for static-prone material, work gently, and move toxic or sensitising powders into a hood, balance enclosure, or other local containment.",
      "cite": "Prudent Practices in the Laboratory, NRC 2011, Ch. 6.D and 6.J. ASHP Guidelines on Handling Hazardous Drugs (powder containment and weighing-by-difference rationale). Field consensus.",
      "confidence": "high",
      "field_consensus": true
    }
  ],
  "conflicts": []
}
